"review_name","review_stars","review_comment"
"eric goeckeritz","1.0 out of 5 stars","If I could leave zero stars as a review, I would. Every single shirt folded up at the hip seam after the first wash. Looks terrible, and even after using an iron, the shirt seams will not lay flat.
Furthermore, the shirts have a very poor fit. The shirt is shaped like a bell. Perhaps I ordered a muumuu by mistake? I am 5 11, and 180lbs, with a normal build. It is inches wider at the hip, then the chest.
Terrible stitching, terrible fit, terrible buy."
"Billy Fitzgerald","1.0 out of 5 stars","Only got 4 shirts!
Nice shirts just missing one, or falsely advertised."
"Ravindra Bhardwaj","1.0 out of 5 stars","After wearing regularly for couple of weeks then fabric got very loose. It looks very loose and did not fit well. I have returned. Thank you Amazon!"
"Danyal S.","1.0 out of 5 stars","Decent Gildan quality, as always and fit/comfort is fine. However, maybe I’m just getting old, but I remember when v-necks weren’t cut so low that you could basically see nipples. The neck is cut way too deep. Like I said, maybe that’s the style Now and I’m getting old, but I’ve not been able to find a v-neck that wasn’t built for rock stars or hipsters in about a decade."
"dave mueller","1.0 out of 5 stars","Worked perfectly out of the packaging but after the first wash... Whoa - turned into a belly shirt and the sleeve shrank too.
Throwaway now as I bought these to be able to tuck them in and stay tucked. That's not happening :("
"OtterDan","1.0 out of 5 stars","I read the reviews here and felt confident that the shirt would not shrink too much. After washing, the length of the T-shirt decreased by almost 2"". Unacceptable. I wore it once after washing and it kept untucking all day long at work. If you like longer T-shirts and you're around 6' tall, don't bother with these."
"Camz","1.0 out of 5 stars","First wash on a delicate cycle the jersey got a hole... poor quality"
"Fabian B.","1.0 out of 5 stars","Based on your size chart I’m suppose to be an XL. When I tried in the shirts, they’re too big, I think your size chart is a little off. Can u be so kind as to send me the correct size, I should be a large. Thanks for ur understanding & help."
"J-tro","1.0 out of 5 stars","I bought these because I love the Gilda brand, but these shrank really bad the first time I washed them so the fit got weird and the bottom hem on a few of them started unraveling. They are pretty soft though."
"Tai","1.0 out of 5 stars","I wouldn't recommend this product. It creates sooo much static cling and, even when so many dryer sheets are used, it still gets hair stuck to it. Any small lint or fuzz that it comes into contact with sticks to it for eeeever. It's so annoying. I cannot recommend this to anyone that doesn't want to spend hours picking off all the hair off it or enjoys lint rolling their shirts every hour."
"Haztive Dominicana","1.0 out of 5 stars","These fit me well, and yet they all have holes. I do not extend them unnecessarily. I remove them by grabbing the bottom. They felt good when they were new, but now they all have holes."
"Nick Hankins","1.0 out of 5 stars","Medium is a tiny bit big, but not bad.
Issue: super thin and see-through. Probably great as a hidden undershirt, not great as an outfit.
Nips for days.
5’10 and 150lbs"
"Vishal Gupta","1.0 out of 5 stars","Please don't sell such cheap stuff....most horrible product I could ever purchase. Even if this was offered for free I would never take these. There is nothing good about the product hence nothing specific. This is overall very poor !! I wish I had opened my package before the return window."
"Andrew Robinson","1.0 out of 5 stars","After the first wash shirts shrink fit really awkward tight in the chest very loose at the bottom best way to describe it it fits like a Sunday dress looks but as a shirt"
"Bob Sears","1.0 out of 5 stars","These shirts fit way to small. I ordered a size up. They are ridiculously small and the v neck is way to big. Will not reorder."
"Mike","1.0 out of 5 stars","Typical cotton t shirts, I am not that tall, only 6’ but can never find a T-shirt that fits good. Just like always, the shirt was poofy at the bottom and too short in the back even though they were “slim” fit. Anywho, they will be paint rags."
"Michael E.","1.0 out of 5 stars","DO NOT WASH THEM UNLESS YOU NEED EXTRA WASH CLOTHS. THESE SHRUNK IN COLD AND HUNG DRY. MATERIAL IS VERY SCRATCHY AND FEELS VERY CHEAP."
"SA","1.0 out of 5 stars","I can't believe that more than 10000 reviews with 4.5 stars are there for this !!! Brought it two weeks back, Washed once in washing machine and this is what happened. It feels rough. 100% cotton though!!!"
"SICKMUZIC","1.0 out of 5 stars","CHEAPLY MADE OF BOTTOM LINE COTTON MATERIAL ONE WEAR THROW AWAY !!!! SORRY . NEVER HAD GILDAN PRODUCT SO POORLY MADE , EXPLAINS PRICE BREAK ..."
"Wen Y.","1.0 out of 5 stars","I liked these shirts because they are cheap and look nice but OMG I wear one of these shirts under my hoodie and lint was stuck on it (look at the picture). The washer and dryer just made it worst. Would not recommend drying with other shirts or clothes. THIS SHIRT is a Lint Trap"
"Mehmet Aytekin","1.0 out of 5 stars","I had almost not expectations while buying this product yet it still managed to disappoint me. Incredible. Don't buy anyone anything from Gildan. It's like they didn't tailor these for humans. I would like to see a single person that these t-shirts fit well. Just don't buy them. please."
"jessica travis","1.0 out of 5 stars","When I received these the idea was to do the dye, but some of the shirts had hole, and one had a sleeve that was half torn off."
"amanda","1.0 out of 5 stars","Stiff material"
"Joel","1.0 out of 5 stars","These shirts looked like they were ten years old after one washing in cold water. The neck was streched out and you had to iron them just to wear around the house. I returned them."
"Complexlitigator","1.0 out of 5 stars","The shirts to the extent they did not arrive with threads hanging, did not make it through the first wash without falling apart."
"DC14","1.0 out of 5 stars","Very thin quality and V neck goes lower then my chest. I thought it was a high V neck and better quality material. Returned."
"AMG","1.0 out of 5 stars","I suppose I should not have expected much for this price. I think they will be useful as garage rags."
"Professor D","1.0 out of 5 stars","This v neck t shirt was a grave disappointment. It did not shrink which might have corrected the problem but it not. It gaps at the neck and looks terrible."
"Ellen88","1.0 out of 5 stars","We always buy Gildan shirts and love them
These were worn once, washed in cool water and all of them shrunk"
"Amazon Customer","1.0 out of 5 stars","Don’t buy! After washing, the neck will be completely off kilter! Doesn’t fit correctly at all! VNeck will be two inches off!"
"TSanta","1.0 out of 5 stars","Pretty rough Feeling cotton. The collar is extremely uncomfortable and presses into my chest. That’s right, these shirts have a sewn on ribbed collar which irritates my skin."
"Rosemarie","1.0 out of 5 stars","Very disappointed. Some were discolored and one had a little hole in the front. I’m guessing that’s why they were on clearance."
"King Kong","1.0 out of 5 stars","Shirts are way to big and stretch at the neck. Makes it look like tour not wearing an undershirt."
"Ismael","1.0 out of 5 stars","Pre-laundry: The fit appears to be full cut, and not athletic as it appears pictured on Amazon. Fabric is soft and comfortable.
Post laundry: washed in cold water, delicate cycle, dried in dryer, med setting.
The shirts are useless rags. Extra wide and extra short. Fabric is course, V-neck is U-neck. Horrible purchase."
"Cathy","1.0 out of 5 stars","These shirts were way to big waste of money they lost their shape after washing and drying no good."
"MT","1.0 out of 5 stars","NOT soft"
"TS 30Something","1.0 out of 5 stars","These shirts have a terrible cut and the material feels coarse. I will be buying something else and pitching these out."
"dR Designs","1.0 out of 5 stars","After one wash they look a year old... They do not feel soft and comfortable, and they are not nicely taylored like the pictures show. This is my second and last attempt to like Gildan t-shirts."
"Dave M","1.0 out of 5 stars","I purchased these shirts, and within a matter of minutes, the shirts look dirty and old. The material is extremely cheap and can't be worn for even an afternoon. I had my coat on over one of these shirts and didn't take it off until I got home, yet the shirt looked filthy as if I had worn it on a construction site. Beware before you buy. Trust me, you will be glad you didn't buy these."
"RVCQ","1.0 out of 5 stars","no goodI after your wash it the neck is cut to large , I Brough Small and they are still to big"
"OperaFamily","1.0 out of 5 stars","There was a hole in the back of one of the tshirts right out of the package. It was folded inside the shirts so it happened in manufacturing not delivery."
"allen","1.0 out of 5 stars","This is a very very cheap shirt
This is Not a vneck
This V next is way to long
The shirt is baggy
Very thin not happy with this shirt at all
Wouldn’t buy again"
"Hotlanta","1.0 out of 5 stars","I'm 5'10 and about 170lb. I got a large and the shirt shrunk after a few wash which make the shirt stupid short. Would not recommend if you're taller than 5'5."
"Tyler Bongiorni","1.0 out of 5 stars","i get vnecks because i like a nice snug shirt. this was HUGE like 2 sizes to big i just wasted almost 20 dollars on a 60 dollar purchase im pretty mad right now. I will never wear these, which really sucks because Theyre really comfy shirts... im 6 feet tall and 190 ibs fit but a large shouldnt be like a bed sheet on me."
"Mr. G","1.0 out of 5 stars","Don't waste your money. They shrink and the collar does not hold its shape. Look more like a U then a V"
"Rich","1.0 out of 5 stars","I ordered the v neck shirts. They are very thin and after one wash the shirts came apart on the bottoms..About 3 feet of thread...Gildans are not what they were since the last time I ordered a year ago!!!"
"S. Miller","1.0 out of 5 stars","Totally looses shape after first wash; neck expands, bottom of shirts curl up, color fades. You get what you pay for; $4.50/shirt."
"JC","1.0 out of 5 stars","These will make you look homeless. The v neck is so large your chest is exposed. Theya re only $3 a shirt, but thats overpriced !"
"Matthew R Wovrosh","1.0 out of 5 stars","These shirts just don't fit. I'm not sure what template they use but they wouldn't really fit anyone at any size. The arms are way too big in an awkward way, And the shirts are way too long. They frankly just look incredibly awkward"
"Matt","1.0 out of 5 stars","Terrible shirts. Not only are they HUGE (in width, not length) but the fabric has to be the worst feeling I've experienced."
"Leo","1.0 out of 5 stars","The shirts are cheaply made. They are super thin and fit horrible. I tried to was them and they shrunk in half. Worst waist of money. DO NOT BUY!!!!!"
"Leslie J","1.0 out of 5 stars","WASTE OF MONEY. THIS FABRIC AND FIT SUCK. HE DIDN'T WANT SLIM FIT BUT THESE ARE BAGGY. WE LIKED THE AMAZON BASICS WAY BETTER"
"b","1.0 out of 5 stars","This shirt looks weird it's right at the sleeve but wide and too long at chest and waste cheap made better off buying a shirt of better quality"
"JP","1.0 out of 5 stars","The material is much too thick and not soft. Y6ou will sweat wearing these shirts."
"S P","1.0 out of 5 stars","Ordered the men's 2X. These shirts will literally fit a 1,000 lb. Man. Will return."
"Sherry","1.0 out of 5 stars","The package arrived with 2 shirts having holes in the armpits. My husband didn't open the pack of shirts until after the return deadline. So, now we're stuck with holy shirts."
"ChrisJ622","1.0 out of 5 stars","These shirts shrunk down to a SMALL. Very disappointed. I will be contacting the seller."
"Smithers","1.0 out of 5 stars","Shirts were marked as the same size but different colors fit differently.
Threads started unraveling within a couple washes.
Some shirts shrunk upward so, now they're too short."
"Matt D.","1.0 out of 5 stars","Shrink shrink shrink yeah they went in trash once they fit 8 year olds"
"D. Ducharme","1.0 out of 5 stars","The shirts all shrink after a couple washes. By the third wash they were all turned into garage rags because they didn’t fit"
"Husband of Mother of Two","1.0 out of 5 stars","All it took was one wash for these things to shrink so much that now they don't even stay tucked in. I am 5'10, 160lbs and ordered large. Awful tee shirts. Why can't someone make an affordable tee shirt that doesn't shrink the first time you wash it?"
"Ken","1.0 out of 5 stars","Terrible quality. Not long enough. Shrunk in wash. Scratchy and itchy. Stretches out while wearing. Worst shirt I've ever purchased on Amazon."
"Nurzhan","1.0 out of 5 stars","The description of this product absolutely bulshit, the sizes of these V-Neck shirts are different!!!
Never never never buy the product from them!!!
I am so freaking upset!!!"
"Eric Tyson","1.0 out of 5 stars","More like an ex-large size. EXACTLY what I didnt want wasted $50.00. Thanks"
"M. M","1.0 out of 5 stars","If you are short waisted and stocky, it might be functionally ok. Not long enought to stay tucked in under a dress shirt, yet very loose fitting. Very disappointed."
"Alejandra hernandez","1.0 out of 5 stars","2 of the shirts were defective. One had a huge hole and the other one was dirty like it was used. I started a return but I haven’t had time to go to the UPS store to return. Don’t but unless you want to drive to return."
"greeg martensite","1.0 out of 5 stars","Thin light weight material. Not the good gildan."
"Tim R.","1.0 out of 5 stars","Ordered these as undershirts for day to day use under dress shirts. The V cut is more of a woman's cut than a man's. The material is ultra thin and comes out of the package feeling like its been used before (picture that commercial where the guy's V looks like a U). It was a good price, but the value's not there. I won't buy again."
"William Roman","1.0 out of 5 stars","It’s a very stiff Cotton, thought it would be softer and a lot of the shirts threading was hanging out. They fit a little bigger than expected I don’t think It’s an exact large"
"FLANERCE","1.0 out of 5 stars","I just needed some white t-shirts and ordered a medium and the ones I recieved fit like a large. I have t- shirts already that are mediums and they do not fit as loose as these. This is inconvenient that now I have to take time out to drop these shirts off at a ups and that whole process. If you order these t-shirts makes sure you order a size down."
"Dr. Jones","1.0 out of 5 stars","The shirt length is wayyyyyyy too short. The overall fit of the shirt is wayyyyyyyy too loose. Honestly threw them away in disgust."
"Nate","1.0 out of 5 stars","Really disappointed, first wash and frayed threads on every shirt"
"Eddie Turner","1.0 out of 5 stars","These shirts are comedically short, which means they don't stay tucked in. It was annoying, I had to get rid of them immediately. I've worn many brands and never had this problem before. I'm paying a few bucks more and getting a reliable brand this time."
"Patrick Alvarez","1.0 out of 5 stars","The material is very itchy. Not comfortable at all, not even as a t-shirt I would want to work in yard with. You get what you pay for..."
"Abdol Hajipour","1.0 out of 5 stars","On the neck was tied it sticks to my body"
"Yigara","1.0 out of 5 stars","These are the worst tshirts I have ever had. Don't waste your money. Better tshirts at dollar tree."
"John T.","1.0 out of 5 stars","I have a set of these shirts that I order about a year ago. They were fine. This set for whatever reason every single one of them the seam where the V meets by the throat is crooked which then in return make one side of the neck longer than the other. Essentially every shirt is lopsided. I didn’t realize this until it was too late to return."
"Kellen H.","1.0 out of 5 stars","The cut of the shirt is so boxy. I have now ordered two sets of these is two different sizes to find that the arms are cut short, torso is short and boxy and doesn’t fit as well as they advertised. Won’t be buying this product again."
"Thomas Laurance","1.0 out of 5 stars","The material is too cheap that its not comfortable to wear and I threw them out / all of them"
"Jordan","1.0 out of 5 stars","Shrinks too much I washed them once they shrank badly I had to give them to my kids to wear"
"Robert_in_CA","1.0 out of 5 stars","Saving money is important, but I recommend paying more for a better T-shirt."
"Venyc82","1.0 out of 5 stars","I have only used 3 shirt of the 6 , and 2 shirts have holes after the second wash. Very bad quality and the return window is already close. Stay away from this brand."
"MAYRA","1.0 out of 5 stars","Gildan went you wash this tshirt come out little or tooooo big. Dont undestand"
"RWR","1.0 out of 5 stars","You don't get what you don't pay for."
"Warriorsfan","1.0 out of 5 stars","simply uncomfortable low quality super cheap product, I would rather spend $7 on 32deg shirts that allows 100x more comfort"
"Leilani Diaz","1.0 out of 5 stars","These hastily sewn together fabrics are being sold as ""t-shirts"" but they fit like bed sheets. The sleeves are oddly short. I look like a sailor who purposely rolls up their sleeves to show off my guns."
"fachmad ben jones","1.0 out of 5 stars","honestly when i received shirts looked crisp, felt very soft and were a bit lengthy....
ONE WASH LATER....SUPER TIGHT BY shoulder and arms and shrunk well more than expected. stick with hanes or fruit of loom none are ideal long term cause lower teir and price and quality, but THESE ARE HORRENDOUS!!!!!!"
"Samurai","1.0 out of 5 stars","Faded after 1st use and too large"
"Crippled guy","1.0 out of 5 stars","I ordered 2XL like the previous 12 shirts. They were made in Honduras. These were made in Bangladesh and they don't have the same pattern. These are more like 1XL; too tight.
I am returning them."
"DaWorkinMan","1.0 out of 5 stars","4-pk NOT 5-pk. Extremely deceptive in pic showing 5-pk. Not only does price go up on XXL, but the number of T-shirts goes down. Nicely tucked away in decription."
"Amazon Customer","1.0 out of 5 stars","Had a hole in one of the shirts upon delivery and the necks got stretched out real quick. Get what you pay for I guess."
"Average user","1.0 out of 5 stars","Ordered XL twice - sent me L's twice"
"_scm_1","1.0 out of 5 stars","Nice material but the neck is way too big in these shirts, almost like a tank top."
"Duke NJ","1.0 out of 5 stars","Not even good enough for rags.
Size is way off and made for obese people to make them feel better.
Size L is actually XXL.
Quality is pure rubbish."
"TRAVIS HILL","1.0 out of 5 stars","Terrible! Wash up horrible. Rough to touch! Useless. Spend more to get more."
"A. Green","1.0 out of 5 stars","I ordered 5 Med shirts and got 2 Med V neck and 3 sm reg tee....my son got more out of it than I did"
"Aref","1.0 out of 5 stars","cotton materials is bad ,Not comfortable and Feel the rough skin"
"DA Technologies","1.0 out of 5 stars","Fit like oversize pajamas. Sleeves are too long. V-neck too large....more like a women's blouse."
"Dave Johnson","1.0 out of 5 stars","Stretched beyond recognition after a few washes. The v-neck is now way too big and looks ridiculous. I won't even wear it to the gym."
"Steve Viking","1.0 out of 5 stars","Every shirt was a different size. Crappy product. Don’t buy it"
"JOHN VIVAS","1.0 out of 5 stars","Mala compra son feas y no me gusta la calidad me arrepiento"
"sher","1.0 out of 5 stars","You get what you pay for"
"Kedwin Guillen","1.0 out of 5 stars","Don't get fooled by the price , poor quality, decoloraion after 1st wash."
"Ernestine","1.0 out of 5 stars","I received 4 shirts instead of five. The shorts were supposed to be assorted but I received 3 black and one odd colored shirt. Not happy with this purchase."
"Zak alsay","1.0 out of 5 stars","The chest was about 46 and was described as 41"
"Tee","1.0 out of 5 stars","Way too small. Order your normal size, if not one bigger.
I went on the information I read in other peoples reviews and it was completely wrong. They recommended ordering 1 or 2 sizes down and noted that the shirts out of the packets were very large. I wear a L so ordered S and guess what, they were small! The sizing chart didn't really help either. Such is the risk of guessing sizes and ordering online."
"Johnathan Pearson","1.0 out of 5 stars","The shirts are all different sizes and the v neck is cut low and awkwardly shaped. I wouldn’t recommend this product."
"Amazon Customer","1.0 out of 5 stars","Strong smell out of the package. Discoloration after only one wash. I've previously purchased this exact pack of shirts before from another retailer. The older shirts look better than these after a single wash."
"Sabrina M.","1.0 out of 5 stars","Shirts fit out of the bag but shrunk in the wash on delicate cold with a low heat dry. Sending back. Frustrating and disappointing."
"Curtis C. Morgan","1.0 out of 5 stars","These are going straight into the rag bin...just awful."
"rs","1.0 out of 5 stars","they need to pre shrink these, makes the quality seem bad, all stretched out etc..."
"Renee","1.0 out of 5 stars","I got the wrong size"
"Juan Perez","1.0 out of 5 stars","Really underwhelmed by these t shirts quality and fit. Very loose fit, short sleeves (compared to overall size), V neck opening is huge as if the shirt had 200 uses, and the fabric was is not that soft. However, in all honesty, its a pack of 6 units for around 15$, so i should have known better."
"Highly recommended NSXED","1.0 out of 5 stars","Good quality highly recommend it"
"David","1.0 out of 5 stars","The v-neck dips much lower on the chest than expected. Wont buy these particular ones again."
"Andrew","1.0 out of 5 stars","The neckline is unusually low while the shoulders too narrow"
"D Davis","1.0 out of 5 stars","These shirts are not soft. Allegedly 100 percent cotton. Feel like sandpaper. rough"
"Happy Day","1.0 out of 5 stars","Design for someone with a large belly. Im on the tone side and the shirt fits pretty loose around my abdomen. Feel like I’m wearing a blanket."
"Steven M. Oleksy","1.0 out of 5 stars","Small for size"
"Eugene","1.0 out of 5 stars","Shirts came in with holes in them. Didn't expect this from Gildan. Haven't made up my mind if its worth going through the hassle of returning yet."
"JOHN D. VENEZIA","1.0 out of 5 stars","It would be a mistake if I brought this again Hannes quality is so much better"
"Insightfully","1.0 out of 5 stars","Horrible and cheap. All the stitching is falling out."
"Amazon Customer","1.0 out of 5 stars","The shirt is ruined right after one wash (holes, overall structure integrity) following wash instruction. I only wore them once too, then washed. They were only great out of their bag brand new. These would be satisfying if you throw your shirts away after the first use."
"brady","1.0 out of 5 stars","Bad cut"
"suresh","1.0 out of 5 stars","One of the t shirt came with holes on it"
"Paul Cox","1.0 out of 5 stars","The shirts are way to thin and feel cheap!"
"CHRISTIAN N ROULA","1.0 out of 5 stars","Amazon advertise for a tight V-neck it is really not, it wide and long down. Very dissatisfied I just bought rags. Returning it will cost to much money. Bought also the white T-shirt I should know better not to buy items like online."
"Joseph","1.0 out of 5 stars","Not worth the cost. The shirts did not fulfill my needs but they may work for others."
"Joey V","1.0 out of 5 stars","Wash them and they are ruined. The shirts become disfigured and fit terrible. They fit great out of the packaging. Will not buy again."
"dhk","1.0 out of 5 stars","It's seems impossible to find a decent t-shirt. It's like nobody cares to to pay attention to what's important. First, the care label it pretty useless and men don't do laundry that way, but it was followed as close as possible. The new shirts were measured against my old Hanes and were over five inches longer. After the first wash and dry on permanent press they shrunk to almost the same size which is too short. Second, the v-neck is not cut right, the t-shirt can be seen when when you wear your top button open on your shirt. They'll make good cleaning rags.
A good t-shirt should not shrink and v-necks should not be seen when the top button on the shirt is open. They should also have practical care instructions and should be able to be washed on hot and dried on high."
"Olivier Dalipagic","1.0 out of 5 stars","The shirt is not slim fit, is cotton thin and very flimsy. Avoid unless you want to use it for car repairs."
"Aiden","1.0 out of 5 stars","Not good"
"Hevher","1.0 out of 5 stars","Do not buy these shirts, the material is rough and super uncomfortable."
"DAZ","1.0 out of 5 stars","Bought large, but there is a small in the package. Apparently, they were sending out opened/returned/mixed items as NEW!"
"Jesse","1.0 out of 5 stars","You get what you pay for.."
"Tater","1.0 out of 5 stars","Very thin material and shrank dramatically.
These shirts are in the garbage, where they belong."
"George","1.0 out of 5 stars","Cheap material. Too thin. One wash now holes all over."
"robert","1.0 out of 5 stars","They go to crap once you wash them"
"Racquel Robertson","1.0 out of 5 stars","After the first wash, the threads at the armpits started to reel out especially in the black ones. Other than that the material is nice and cool, but the quality of the make of the shirts is very poor."
"Jessica","1.0 out of 5 stars","Horrible right out of the dryer it’s is the size of a kids tee"
