"review_name","review_stars","review_comment"
"Amazon Customer","1.0 out of 5 stars","After a wash, the V neck area got all wrinkled."
"3384","1.0 out of 5 stars","The v neck t- shirt ,I never recites them and if i did they should of been size xxx .So what do i do now . Thank You Curt Gardner"
"Lucas j","1.0 out of 5 stars","very bad quality"
"RODOLFO JOSE GUIRIGAY","1.0 out of 5 stars","Tuve q devolver el producto, el cuello en V era muy grande."
"Rockford","1.0 out of 5 stars","Ordered and received 2X the size of a Large, too small for me."
"Amanda","1.0 out of 5 stars","The shirts came and they are great... However in two of the shirts that arrived they have tiny holes in them. Very disappointing"
"Kenneth J. King","1.0 out of 5 stars","the neck hole is too far back. the shirt pulls up around the neck"
"Mel","1.0 out of 5 stars","Cheap material, not very good looking when wearing them."
"Ted Flores","1.0 out of 5 stars","My wife medium first and they were to small on the chest and shoulders, I ordered the large and there to big. Thank5"
"Michael khan","1.0 out of 5 stars","Fits ok but the threading started coming out after the first wash. A worst buy!"
"Pan","1.0 out of 5 stars","Stitching came out under arm of one shirt on first wear. I was lazing about, no heavy use. Only the second one I have worn. Poor quality. Amazon should and could do better with the products they promote."
"Arawak","1.0 out of 5 stars","V-neck is too wide"
"Emily","1.0 out of 5 stars","The shirt is way too big. I normally wear the same size but these shirts run larger. Took way to long to ship, even with amazon prime."
"David A. Culver","1.0 out of 5 stars","Fellow undershirt wearing colleagues: this is like wearing sandpaper under your dress shirt. I don’t know how they got such good reviews and why Amazon would recommend them so highly. To the trash they will go. Do not purchase!"
"raj","1.0 out of 5 stars","These tshirt are way too small."
"barb","1.0 out of 5 stars","Only 4 T-shirts instead of 5."
"margaret","1.0 out of 5 stars","there was a mistake, it shows that i ordered the wrong style of t-shirts, i received the v-neck style i don't how that was possible, i always double check my order before i click accept , i really feel something went wrong?"
"mstasek","1.0 out of 5 stars","The shirts are loose almost blousey. Not good for tucking in as an undershirt. The material is not soft like you would expect cotton to feel."
"cesar","1.0 out of 5 stars","The worst purchase I have ever made, first I thought I was not washing clothes properly, but I have to do several washing tests with these shirts, since you put them on they smell bad, no matter what detergent you use."
"Omar","1.0 out of 5 stars","Very bad product"
"Bob","1.0 out of 5 stars","Enjoy wearying one time because they shrink down at least a size on very first wash."
"Rogue827","1.0 out of 5 stars","Ordered a large size pack and the size is more like xxl. Shirt is made from rough cotton"
"GSchaeferina","1.0 out of 5 stars","Don't buy junk!"
"Pablo Rodriguez","1.0 out of 5 stars","Not really comfortable and shrinks quite alot in the dryer in comparison to hanes. Much cheaper though."
"Cliente de Amazon","1.0 out of 5 stars","Mal confección y mala tela"
"Ses","1.0 out of 5 stars","These t shirts shrunk with frist cold water wash"
"ceilidhe","1.0 out of 5 stars","Thin and fade fast"
"Chen Zhi Gang","1.0 out of 5 stars","This product has shrunk seriously after washing. This lesson taught me not to be greedy for cheap."
"Howard ODell","1.0 out of 5 stars","I bought extra large and after washing them they shrunk up about two sizes I can’t wear a bad buy"
"Kendall Hissem","1.0 out of 5 stars","Shirts are much larger than XXL.. one fell apart on the first wash."
"Theo_W","1.0 out of 5 stars","The quality of the tshirt were not good, they are also not stretchy at all, going back to Gap tshirts.
This ones will be donated"
"Rodrigo Lindemberg","1.0 out of 5 stars","Bad. Very bad quality. I thought it might be fairly good, but quality is much worst than I expected. Even for a cheap shirt. Very disappointed."
"epmoreno","1.0 out of 5 stars","Not worth it, recently purchased these shirts & they are already wearing out & strings are coming apart, will not purchase again"
"TWIIN","1.0 out of 5 stars","First wash, the v-neck got larger and the length of the shirt shortened too much. Poor quality Never again will i buy these"
"Braulio Padron","1.0 out of 5 stars","way to wide at the waist looks wanky. Decided to wash them to see if they would shrunk some I was wrong"
"Bill Denson","1.0 out of 5 stars","Perfect fit before wash; shrank two sizes in first wash."
"Amazon Customer","1.0 out of 5 stars","very cheap quailty disappointed"
"George Jeha","1.0 out of 5 stars","Wider neck and upper chest than usual looking more square than rectangle"
"Amazon Customer","1.0 out of 5 stars","The v extends too far down your chest"
"Ricardo","1.0 out of 5 stars","Dos de las camisetas estaban rotas endefinitiva solo dare 1 estrella por eso no me sirvio mucho esta compra."
"T","1.0 out of 5 stars","Not true to fit, extremely wide bodied"
"Amazon Customer","1.0 out of 5 stars","I wouldn't order this again."
"Amanda Riel","1.0 out of 5 stars","Their shirts where big, then after being washed to small, and they dont sit right and look sloppy!"
"yer xiong","1.0 out of 5 stars","You would think they do a good job at packing clothes, I guess I just lost 1 shirt to dirty dust."
"Miguel Jimenez","1.0 out of 5 stars","I ordered a pack of the assorted v-neck shirts by Gildan and I was highly disappointed. The v-neck part of the shirt was too wide and the fabric was extremely thin. Please stay away if you can and buy them from the mall instead."
"Joshua Dickey","1.0 out of 5 stars","I got a size bigger than I normally get and they still were extremely small. Haven’t been able to wear the shirts at all"
"sandy","1.0 out of 5 stars","Shirt tore in under arm after first wash"
"Leroy wallace","1.0 out of 5 stars","Awful"
"cin","1.0 out of 5 stars","After 2-3 washings noticed little holes just started appearing, and just gets worse from there. (Have already converted 3 tshirts from pack into polishing rags). Have never seen a t-shirt do that before. Weird."
"Ghassan","1.0 out of 5 stars","Low quality"
"M. Patterson","1.0 out of 5 stars","Miserable quality. I ordered x-large and they are about as wide as a xxL and have absolutely no length. I basically bought a stack of rags."
"Bish","1.0 out of 5 stars","The t-shirt looks and feels cheap. Material quality was flimsy and rough to touch. I ordered a large and the fit was a bit loose for me. Returned it for full refund."
"John C","1.0 out of 5 stars","Product started coming apart at the hem within 11/2 months. Won't buy again."
"Mark","1.0 out of 5 stars","I found these shirts to be itchy, too short, and of poor quality. There are threads all over the place"
"TAD","1.0 out of 5 stars","Was hoping for a better fitting and softer v-neck shirt. That i could wear under shirts. Not so much.
Don’t waste ur money."
"Garen Hanlon","1.0 out of 5 stars","These T-shirts are TERRIBLE. They don't fit well, the neck is so large I can stick my hands through the neck and take it off like a pair of shorts. Amazon I can't believe you would sell such junk!"
"ed808","1.0 out of 5 stars","V neck too darn long. Thin shirt, stretches and do return to normal."
"Amazon Customer","1.0 out of 5 stars","These shirts are a waste of time. The sizing is too big. Once they are washed, they get very mishaphen and practically useless. The v neck gets huge and the whole t shirt becomes unwearable. Don't bother."
"Anand","1.0 out of 5 stars","I order a US Medium size T-Shirt. It fit perfectly fine until I washed the T-Shirt. T-Shirt shrunk after the first wash, and now it's too tight and uncomfortable to wear.
Waste of money."
"Pamela’s wants","1.0 out of 5 stars","These tee shirts shrink up too much. They fit great until I washed snd dried them. Now they won’t tuck in."
"Abril Rodriguez","1.0 out of 5 stars","Mal empacado y sueltos. Y la tela mala calidad. Y enviaron 4 camisetas negras y una gris no fue asi como se pidieron. Publicidad engañosa."
"D. Heckman","1.0 out of 5 stars","Very poor quality cotton and the sleeves tended to bunch up in my arm-pit! I only wore one shirt, one time only and the cotton is coarse and uncomfortable. I am now using these shirts for vehicle maintenance and household cleaning."
"The Cozies","1.0 out of 5 stars","When I first tried it on, the shirts fitted perfectly. However after I washed it and dried them it shrunk and the size is too small now."
"Raja Rabi","1.0 out of 5 stars","To loose from neck, will return"
"Amazon Customer","1.0 out of 5 stars","Bad quality"
"Amazon Customer","1.0 out of 5 stars","Uncomfortable material"
"Christopher L.","1.0 out of 5 stars","They stunk after one wash"
"Aji Vadakottu","1.0 out of 5 stars","Product is ok but I ordered a large and it seems like it’s an extra large. It was literally hanging off me. I decided to not return it and wear it just around the house but was looking to wear it outside"
"Jimmy C","1.0 out of 5 stars","Fits in shoulders and chest. It fit out of the package around waste. Washed one time and now it’s a skirt. A high skirt. Don’t waste your time. Buy a better brand"
"Bobby T","1.0 out of 5 stars","These shirts are lowest quality. Washed once, half have stretched necks."
"John Paul","1.0 out of 5 stars","Too short to wear as an undershirt. Too cheap to wear as a regular shirt."
"rpj","1.0 out of 5 stars","Very Low quality. Wear and trash after first use!"
"Joshua Roberts","1.0 out of 5 stars","Tried them on before washing and they fit pretty well. Gave them a wash before wearing in cold water and low dry. Afterward the shirt was way too tight above practically at my belly button. Returning for a refund."
"lorie maak","1.0 out of 5 stars","These were good for like 5 wash and wears, but the quality is not good and they have since been tossed."
"H.P.","1.0 out of 5 stars","Not comfortable. Material is very stiff even after a couple of wash."
"Greg B","1.0 out of 5 stars","Paper thin, wrinkles and shrunk 2 sizes"
"Amazon Customer","1.0 out of 5 stars","Do not like this item as soon as my husband opened the package there was a hole in the first shirt!😡😡😡 I am sending back and not reordering this item!!! Shirley Quinn"
"Craig G.","1.0 out of 5 stars","Worst shirts ever. I should have known. After one wash they were all stretched out and unusable. Horrible."
"Danny","1.0 out of 5 stars","Usually get the same brand i. Store with no problem. The neckline was yoo large and no one shirt fit the same. I guess you get what you pay for. Expensive rags though."
"Brett Jacobs","1.0 out of 5 stars","The neck was that of a 4XL shirt. Also shipped 2 wks late."
"Eduardo","1.0 out of 5 stars","Good for nothing, cheap fabric, run extremely wide, i hate everything about it"
"Christine Baizley","1.0 out of 5 stars","Falling apart at the seams."
"DOMINICK A GENOVESE SR","1.0 out of 5 stars","the shirts were see threw cotton was thin never saw a cheaper shirt will use them as rags not even to ware cleaning the yard"
"Eugene V. Rowls","1.0 out of 5 stars","Returned to Amazon"
"Snyder","1.0 out of 5 stars","Supposed to be 5 t-shirts but only a 4 pack arrived"
"andre Sephers","1.0 out of 5 stars","Faded and shrunk on the first wash (cold water and low heat dry) ... maybe I'll use them as a fire starter for summer bonfire"
"David Silsby","1.0 out of 5 stars","I got 4 v-neck x-large t-shirts and one large crew neck t-shirt and this is the second time I have tried to post this"
"Boban","1.0 out of 5 stars","Don’t know what these sizes were but they are definitely not XL"
"susan siman","1.0 out of 5 stars","Por favor necesito saber de este pedido ....DICE ENTREGADO PERO NO LLEGO NUNCA"
"Starfish","1.0 out of 5 stars","It shrunk terribly after first wash, it became immediately unwearable. Wasted money."
"Delroy","1.0 out of 5 stars","I am very much displeased with the shirts' I am 250 lb and I ordered 1x large and it was extremely large I had to resell them."
"Amazone customer","1.0 out of 5 stars","Product was opened and 2 of the 5 shirts were there. Not really worth your time, going through amazone to get this correct. Shouldn’t have to spend time on that."
"Mariann","1.0 out of 5 stars","Get what you pay for
Shrunk a lot after 1st wash"
"Amazon Customer","1.0 out of 5 stars","This product is garbage"
"Amazon Customer","1.0 out of 5 stars","I wash them before husband can wear them and when I was folding them I saw this little dots I was very disappointed."
"Cap1","1.0 out of 5 stars","Poor quality tees, don’t wast your money. Also the V neck is way too large around the neck"
"Michael S","1.0 out of 5 stars","Poor quality. The hems unrave on the first wash!"
"Amazon Customer","1.0 out of 5 stars","Got the shirts before estimated date which was awesome but the shirts run small and one of the shirts had a black spot on it. I’m returning the pack of shirts. They are really see threw also."
"Kiyyah Locke","1.0 out of 5 stars","Item ran too large and each t-shirt arrived with a small hole in the front"
"Amazon Customer","1.0 out of 5 stars","Disgusting cheap cheap and see through hanging thread poorly made"
"Amazon Customer","1.0 out of 5 stars","First wash before putting it on - length shorten to my belt. 2nd wash lost its color and length shorten by little more. Not the product I would recommend to anyone."
"Veron","1.0 out of 5 stars","Order a size smaller. I measured my chest to fit the size chart and the t shirts that arrived are much too large."
"Julissa","1.0 out of 5 stars","had to return them. they were so dirty"
"Hearty","1.0 out of 5 stars","I'm very disappointed with this order. I order the one for 5 pack as stated on my order and arrived in my place 4 pack so I request for a replacement due to incorrect number of shirt and still came in 4 pack."
"theboss5161","1.0 out of 5 stars","It was ok"
"Juan","1.0 out of 5 stars","I used the size chart picture as a reference, buy an M size based on the chart and got like an L size instead... Picture is wrong"
"Chandni Sahni","1.0 out of 5 stars","This is horrible quality! We put it in the wash before wearing and and it’s shrank, all the threads are coming out and the shirts look like they are 2 months worn."
"Amy","1.0 out of 5 stars","Not good material"
"Chelse","1.0 out of 5 stars","I love these shirts generally.... but I deff didn’t get the colors pictured. The white is the reason I ordered these to begin with. Not happy at all. Only giving a 1 star because I can’t do zero."
"Amazon Customer","1.0 out of 5 stars","En este paquete que supuestamente tenía 6 franelas me enviaron cinco y una de ellas al parecer la encontraron en el basura. Quién supervisa estos paquetes antes de salir a su destino?"
"JSaun","1.0 out of 5 stars","These shirts are like all Gilden undershirts, as soon as you wash them they shrink up. I am a taller person and this is the second time I have order Gilden undershirts and after washing them they are barely long enough to tuck in my pants."
"Marinno","1.0 out of 5 stars","Horrible quality. I found better quality at the dollar store.Looks like it was made from recycled materials.Scratchy rough materials."
"Jerome A Rogan","1.0 out of 5 stars","These shirts wrinkle terribly. Then the second time I washed them, two of them came out full of small holes. Garbage, I’m very disappointed."
"Lindy Bass","1.0 out of 5 stars","Horrible! Wear them 5 minutes and they are all out of shape. Very sloppy looking. The arm holes are huge!! And I have big arms."
"CHRISTIAN N ROULA","1.0 out of 5 stars","I bought rags v-neck showed tight as I wish it to be instead it was wide long down my chest. Dissatisfied !"
"steeno253","1.0 out of 5 stars","Washed once and shrank too a small."
"Maria polanco","1.0 out of 5 stars","No me llegó y la foto que enviaron no es de mi puerta!"
"Chris","1.0 out of 5 stars","Just a regular, no shape to it t shirt. Horrible fitment."
"Super love","1.0 out of 5 stars","The v neck comes to like the middle of chest more like the Stomach area I don’t like that it should b fitted showing a Lil chest and not the stomach"
"Carroll R Peters","1.0 out of 5 stars","Theses shirts are poor quality...they stretched and became out of shape and saggy after one wear and wash."
"Amazon Customer","1.0 out of 5 stars","I am not sure why there is a hole there???
It looks like it was cut in to on purpose. The pack doesn’t indicate the size of the shirt."
"Aylin Khoshaba","1.0 out of 5 stars","This is obviously fake. The material is so thin , the shirt is longer. The print (the tags label) OMG is so fake. Gildan, seriously??????"
"Henry","1.0 out of 5 stars","Size chart is incorrect don't know why they use it.
Do not go by the size chart runs super large.
Now I need to go to hassle of returning this crap"
"Amir Ahmadi","1.0 out of 5 stars","Not happy with this purchase would like to return , material feels rough and hard , nothing like the descriptions."
"Rajat Pungaliya","1.0 out of 5 stars","Poor quality of T-shirts. Fitting is terrible. Kind of small at the top and large at the bottom, looks really bad.
Shrinks after washing."
"Myrna Gutierrez","1.0 out of 5 stars","Shirts shrunk to a very small size, very disappointing I bought as gift for son and son in law now they got a skinny 8 year old"
"Amazon Customer","1.0 out of 5 stars","Too big"
"Amazon Customer","1.0 out of 5 stars","the shirts arrive with a hole, and of very poor quality, waste of money"
"Andrew F Polesovsky","1.0 out of 5 stars","Do you like undershirts that are too short to stay tucked in below the belt?! Then order away!
Low quality that shrunk after one wash in cold water too. I'll be throwing these out."
"Mohammed Jalil","1.0 out of 5 stars","It’s too large"
"Morgan","1.0 out of 5 stars","THIS IS NOT A V NECK SHIRT!!!
I specifically bought these bc I wanted v neck shirts and they are crew neck shirts..."
"Rigo","1.0 out of 5 stars","Poor design"
"glows","1.0 out of 5 stars","Super thin and see through, not worth the money."
"Jenna Makos","1.0 out of 5 stars","All of the shirts arrived with large holes in them... approximately 2-3 inches in diameter.... they are all garbage. Extremely unhappy"
"Wys","1.0 out of 5 stars","The top shirt has a big stain on the V, these have to be clean for my son going to Coast Guard, regardless who wants a big stain on a white tshirt"
"Amazon Customer","1.0 out of 5 stars","One of the sleeves was not totally sewn to the body of the shirt."
"Michael Hubbard","1.0 out of 5 stars","These shirts are about as soft as sandpaper. I noticed one had a hole in it after the first wash, before I even had a chance to wear it. Buyer beware.."
"Jk","1.0 out of 5 stars","These shirts were all messed up. The v neck was actually stitched incorrectly & the v points to the right, so off center. Just poor quality."
"Nick C.","1.0 out of 5 stars","Too Loose wish I could return after washing them"
"Amazon Customer","1.0 out of 5 stars","Bought V neck undershirts so that you can't see it at the neck beneath a normal button-up collared shirt. You can totally see it. Defeats the purpose. Have to order from elsewhere, I guess."
"Douglas Williams Jr.","1.0 out of 5 stars","The size of the v-neck is much larger than that shown on the photos on the website."
"Morty","1.0 out of 5 stars","It has a wonky fit for men’s with taller torsos, ordered a xxl and feel like it is cut too short for me. I’m 6’2”"
"Maybeth","1.0 out of 5 stars","Despues de la primera lavada quedo como una sabana pesima pesima calidad"
"RichieRich69","1.0 out of 5 stars","Garbage material. loses its shape after two washes"
"George","1.0 out of 5 stars","Shirt had a tear after only being worn once."
"Roberta","1.0 out of 5 stars","Poorly made!!"
"Amazon Customer","1.0 out of 5 stars","Product shrunk significantly after one wash."
"Amazon Customer","1.0 out of 5 stars","I received 5 different color Tee Shirts, but didn’t receive a white tees shirt like from the picture shows was suppose to come with order."
"Anon","1.0 out of 5 stars","Shrinkage. My dryer rarely ever shrinks anything. One wash with other items of which remained fine and these t-shirts are two sizes smaller."
"melissa","1.0 out of 5 stars","It says 5 pack in the description I received 3 4 packs instead I was going to just deal with it but one of the shirts was torn at the seem right out of the package"
"Jonathan Wright","1.0 out of 5 stars","These shirts are terrible quality. The neck line is stretched after one wash and looks like I have own the shirt for years"
"DTV","1.0 out of 5 stars","Cheap look"
"Terrence","1.0 out of 5 stars","I ordered them small but they fit rather large I had to shrink them in cold water I’m not satisfied at all I don’t recommend this item"
"YP","1.0 out of 5 stars","Shirts under arm area threads ripped within 2 weeks. wouldnt recommed for long term unless you need cheap throw away shirt"
"Joshua pierceall","1.0 out of 5 stars","Not good quality. Some of the shirts seams came apart after washing. Also they wrinkle when they come out of the dryer."
"Joanne Slauson","1.0 out of 5 stars","Package arrived as shown with nickle size hole already outlined."
"Gene S.","1.0 out of 5 stars","I ordered a pack of medium and the fit is too loose. I like my undershirts to be snug."
"Daniel kleiner","1.0 out of 5 stars","On the photos it lookels like a slim shirt but its not its too loose unfortunately i dont like this"
"Daniel Calhoon","1.0 out of 5 stars","received only 4 of the 5 shirts..Did not get the white one"
"Ottis","1.0 out of 5 stars","Crap! Fell apart after first was. Don't buy it. Trust me."
"Takisha","1.0 out of 5 stars","I thought that the shirts would have been a little more fitted then loose. I can’t fit the shirts"
"Kenneth Andrew Calvert","1.0 out of 5 stars","After about a year, stitching is unraveling on a few of the shirts from one pack."
"Charlie B","1.0 out of 5 stars","Way to small"
"Kk","1.0 out of 5 stars","Don’t recommend, nothing like the picture"
"Amazon Customer","1.0 out of 5 stars","Very disappointed in how they looked after i washed them. They shrunk and looked very wrinkled"
"AmazonBR","1.0 out of 5 stars","Arrived with dark stains looks like dirt or mold and the lower stain blue ink"
"Jagger Smocer","1.0 out of 5 stars","V neck was off once bought and after 1 wash forget about it you get use maybe out of each shirt before you throw them out"
"Arturo V.","1.0 out of 5 stars","Me picaban en la piel. El diseño no era bueno."
"todd","1.0 out of 5 stars","Hard to write that it’s too large and too small
Arms floppy big , not snug through waist
Basically a cheap tee"
"Edward","1.0 out of 5 stars","I wear medium in all shirts and never do I have a problem with the armpit area, these shirts are so tight in the armpit it rolls the sleeves up by themselves! Buy one and check for fit before buying bulk"
"Amazon Customer","1.0 out of 5 stars","Product came open and missing 1 shirt"
"Kelly","1.0 out of 5 stars","After you watch any of these shirts even in cold water on delicate they will shrink and be way too short"
"Amazon Customer","1.0 out of 5 stars","I am surprised at how poorly made these are. If you’re interested in these, just go with something else."
"Ash","1.0 out of 5 stars","Tears easily"
"Amazon Customer","1.0 out of 5 stars","Neck is gigantic and it’s so body it’s a terrible fit"
"Josh","1.0 out of 5 stars","One shirt had a hole in it. 2 shirts had sleeves with different lengths that were extremely noticeable. The other 3 shirts were ""meh"" at best."
"NO","1.0 out of 5 stars","The actual sleeve length on the short sleeve is too short"
"Amazon Customer","1.0 out of 5 stars","worth exactly the price .... very cheap.
quality is bad, stitching is rough, sizing is too large."
"Liz Gianessi","1.0 out of 5 stars","Faded after one wash, disappointed"
"Dennis H.","1.0 out of 5 stars","Cheap and thin"
"My4monstermonkyboyz","1.0 out of 5 stars","Not a men's shirt. The V-neck is too low. The fabric is good, so I ended up giving them to my niece."
"Eduardo","1.0 out of 5 stars","Bad quality. Shrink after washing"
"Amiran Khutsishvili","1.0 out of 5 stars","I ordered m size but thei sent me us m size that's why it doesn't fit me"
"Southern Gentleman","1.0 out of 5 stars","Didn’t fit"
"Amazon Customer","1.0 out of 5 stars","Poor quality, they all shrank in weird places. Like the sleeves."
"SherryiLBC","1.0 out of 5 stars","Shirts come with tears. I know it’s an undershirt, but for $17 I don’t expect for the shirts to arrive with holes."
"Kevin T. Stein","1.0 out of 5 stars","Too boxy ! The image appeared to be more athletic fit . Not what I expected . If possible would like a credit ."
"andre wellesely","1.0 out of 5 stars","Way way way too big. Really just a waste of money. I always get the same size but this brand just fits huge."
"Timmy Haines","1.0 out of 5 stars","Quality wasn’t as expected"
"Amazon Customer","1.0 out of 5 stars","They shrink after the first wash, the width isn’t bad, but shrinks up from the bottom. Wouldn’t recommend."
"C L Steele","1.0 out of 5 stars","Liked nothing disliked everything."
"David Thibodeaux","1.0 out of 5 stars","Ordered these hoping for a great deal - instead, I got 4 crew necks and 1 vneck.
Buyer beware."
"David Sullivan","1.0 out of 5 stars","Cleary advertises as a 5 pck but only sends a 4 pack. Very low quality as well. I would never buy again."
"Amazon Customer","1.0 out of 5 stars","Solo se ven bien en fotos"
"Amazon Customer","1.0 out of 5 stars","I received 4 pack but not 5 pack..."
"FiftyPHX","1.0 out of 5 stars","The neck is extremely streched out"
"Amazon Customer","1.0 out of 5 stars","V neck was huge, it looked like I was wearing a big ass basketball jersey."
